{
  "id": "b46fa060-a5fe-4144-94dc-24d5041c9f10",
  "label": "NAT S1-R3-video (both destination IP address and port must match for this policy to be applied)",
  "match": {
    "destination_ip": "239.1.2.3",
    "destination_port": 4500
  },
  "translated": {
    "destination_ip": "235.7.8.9",
    "destination_port": 10500
  },
  "receiver_endpoint_ids": [
    "b4aa4549-ef19-460b-9c93-76b41457af48"
  ]
}
